PMID,Title,Authors,Citation,First Author,Journal/Book,Publication Year,Create Date,PMCID,NIHMS ID,DOI
"32925035","Structural Change of Gut Microbiota in Patients with Post-Stroke Comorbid Cognitive Impairment and Depression and Its Correlation with Clinical Features","Ling Y, Gu Q, Zhang J, Gong T, Weng X, Liu J, Sun J.","J Alzheimers Dis. 2020;77(4):1595-1608. doi: 10.3233/JAD-200315.","Ling Y","J Alzheimers Dis","2020","2020/09/14","","","10.3233/JAD-200315"
"25875451","Sorghum (Sorghum bicolor L.): Nutrients, bioactive compounds, and potential impact on human health","de Morais Cardoso L, Pinheiro SS, Martino HS, Pinheiro-Sant'Ana HM.","Crit Rev Food Sci Nutr. 2017 Jan 22;57(2):372-390. doi: 10.1080/10408398.2014.887057.","de Morais Cardoso L","Crit Rev Food Sci Nutr","2017","2015/04/16","","","10.1080/10408398.2014.887057"
"34090773","The effect of dietary fiber (oat bran) supplement on blood pressure in patients with essential hypertension: A randomized controlled trial","Xue Y, Cui L, Qi J, Ojo O, Du X, Liu Y, Wang X.","Nutr Metab Cardiovasc Dis. 2021 Jul 22;31(8):2458-2470. doi: 10.1016/j.numecd.2021.04.013. Epub 2021 Apr 28.","Xue Y","Nutr Metab Cardiovasc Dis","2021","2021/06/06","","","10.1016/j.numecd.2021.04.013"
"31162138","High dietary salt-induced dendritic cell activation underlies microbial dysbiosis-associated hypertension","Ferguson JF, Aden LA, Barbaro NR, Van Beusecum JP, Xiao L, Simmons AJ, Warden C, Pasic L, Himmel LE, Washington MK, Revetta FL, Zhao S, Kumaresan S, Scholz MB, Tang Z, Chen G, Reilly MP, Kirabo A.","JCI Insight. 2019 Jun 4;5(13):e126241. doi: 10.1172/jci.insight.126241.","Ferguson JF","JCI Insight","2019","2019/06/05","PMC6629246","","10.1172/jci.insight.126241"
"33491590","Gestational gut microbial remodeling is impaired in a rat model of preeclampsia superimposed on chronic hypertension","Ishimwe JA, Akinleye A, Johnson AC, Garrett MR, Sasser JM.","Physiol Genomics. 2021 Mar 1;53(3):125-136. doi: 10.1152/physiolgenomics.00121.2020. Epub 2021 Jan 25.","Ishimwe JA","Physiol Genomics","2021","2021/01/25","PMC7988742","","10.1152/physiolgenomics.00121.2020"
"33380119","Obstructive sleep apnea and hypertension: the role of gut microbiome","Šiarnik P, Klobučníková K, Mucska I, Hlucháňová A, Hanus O, Turčáni P, Kollár B.","Vnitr Lek. 2020 Fall;66(7):415-419.","Šiarnik P","Vnitr Lek","2020","2020/12/31","","",""
"30452697","Novel perspectives on fermented milks and cardiometabolic health with a focus on type 2 diabetes","Fernandez MA, Marette A.","Nutr Rev. 2018 Dec 1;76(Suppl 1):16-28. doi: 10.1093/nutrit/nuy060.","Fernandez MA","Nutr Rev","2018","2018/11/20","PMC6280950","","10.1093/nutrit/nuy060"
"34277461","Chronic Intermittent Hypoxia Participates in the Pathogenesis of Atherosclerosis and Perturbs the Formation of Intestinal Microbiota","Hu C, Wang P, Yang Y, Li J, Jiao X, Yu H, Wei Y, Li J, Qin Y.","Front Cell Infect Microbiol. 2021 Jul 1;11:560201. doi: 10.3389/fcimb.2021.560201. eCollection 2021.","Hu C","Front Cell Infect Microbiol","2021","2021/07/19","PMC8281814","","10.3389/fcimb.2021.560201"
"34634561","Jaboticaba (Myrciaria jaboticaba) powder consumption improves the metabolic profile and regulates gut microbiome composition in high-fat diet-fed mice","Soares E, Soares AC, Trindade PL, Monteiro EB, Martins FF, Forgie AJ, Inada KOP, de Bem GF, Resende A, Perrone D, Souza-Mello V, Tomás-Barberán F, Willing BP, Monteiro M, Daleprane JB.","Biomed Pharmacother. 2021 Dec;144:112314. doi: 10.1016/j.biopha.2021.112314. Epub 2021 Oct 8.","Soares E","Biomed Pharmacother","2021","2021/10/11","","","10.1016/j.biopha.2021.112314"
"32112136","Effect of probiotics on the intestinal microbiota of hemodialysis patients: a randomized trial","Liu S, Liu H, Chen L, Liang SS, Shi K, Meng W, Xue J, He Q, Jiang H.","Eur J Nutr. 2020 Dec;59(8):3755-3766. doi: 10.1007/s00394-020-02207-2. Epub 2020 Feb 28.","Liu S","Eur J Nutr","2020","2020/03/01","","","10.1007/s00394-020-02207-2"
"34557424","Gut Lactobacillus Level Is a Predictive Marker for Coronary Atherosclerotic Lesions Progress and Prognosis in Patients With Acute Coronary Syndrome","Gao J, Wang J, Zhao LL, Yao TT, Chen Y, Ma J, Zhang X, Wang JX, Wang Y, Cui Z, Liu Y.","Front Cell Infect Microbiol. 2021 Sep 7;11:687827. doi: 10.3389/fcimb.2021.687827. eCollection 2021.","Gao J","Front Cell Infect Microbiol","2021","2021/09/24","PMC8452980","","10.3389/fcimb.2021.687827"
"29525681","Gut microbiota dysbiosis is associated with Henoch-Schönlein Purpura in children","Wang X, Zhang L, Wang Y, Liu X, Zhang H, Liu Y, Shen N, Yang J, Gai Z.","Int Immunopharmacol. 2018 May;58:1-8. doi: 10.1016/j.intimp.2018.03.003. Epub 2018 Mar 8.","Wang X","Int Immunopharmacol","2018","2018/03/12","","","10.1016/j.intimp.2018.03.003"
"35324673","Microbiome in Chronic Kidney Disease (CKD): An Omics Perspective","Lohia S, Vlahou A, Zoidakis J.","Toxins (Basel). 2022 Feb 26;14(3):176. doi: 10.3390/toxins14030176.","Lohia S","Toxins (Basel)","2022","2022/03/24","PMC8951538","","10.3390/toxins14030176"
"34426332","Propamocarb exposure has the potential to accelerate the formation of atherosclerosis in both WT and ApoE(-/-) mice accompanied by gut microbiota dysbiosis","Jin C, Weng Y, Zhang Y, Bao Z, Yang G, Fu Z, Jin Y.","Sci Total Environ. 2021 Dec 15;800:149602. doi: 10.1016/j.scitotenv.2021.149602. Epub 2021 Aug 12.","Jin C","Sci Total Environ","2021","2021/08/24","","","10.1016/j.scitotenv.2021.149602"
"26274026","Microbiology Meets Big Data: The Case of Gut Microbiota-Derived Trimethylamine","Falony G, Vieira-Silva S, Raes J.","Annu Rev Microbiol. 2015;69:305-21. doi: 10.1146/annurev-micro-091014-104422. Epub 2015 Aug 13.","Falony G","Annu Rev Microbiol","2015","2015/08/15","","","10.1146/annurev-micro-091014-104422"
"34407384","Modulating host gene expression via gut microbiome-microRNA interplay to treat human diseases","Mody D, Verma V, Rani V.","Crit Rev Microbiol. 2021 Sep;47(5):596-611. doi: 10.1080/1040841X.2021.1907739. Epub 2021 Apr 6.","Mody D","Crit Rev Microbiol","2021","2021/08/18","","","10.1080/1040841X.2021.1907739"
"30508676","Fecal microbiota transplantation alleviates myocardial damage in myocarditis by restoring the microbiota composition","Hu XF, Zhang WY, Wen Q, Chen WJ, Wang ZM, Chen J, Zhu F, Liu K, Cheng LX, Yang J, Shu YW.","Pharmacol Res. 2019 Jan;139:412-421. doi: 10.1016/j.phrs.2018.11.042. Epub 2018 Nov 30.","Hu XF","Pharmacol Res","2019","2018/12/04","","","10.1016/j.phrs.2018.11.042"
"34684454","Pathobiological Relationship of Excessive Dietary Intake of Choline/L-Carnitine: A TMAO Precursor-Associated Aggravation in Heart Failure in Sarcopenic Patients","Bin-Jumah MN, Gilani SJ, Hosawi S, Al-Abbasi FA, Zeyadi M, Imam SS, Alshehri S, Ghoneim MM, Nadeem MS, Kazmi I.","Nutrients. 2021 Sep 29;13(10):3453. doi: 10.3390/nu13103453.","Bin-Jumah MN","Nutrients","2021","2021/10/23","PMC8540684","","10.3390/nu13103453"
"28640714","An unexplored brain-gut microbiota axis in stroke","Wen SW, Wong CHY.","Gut Microbes. 2017 Nov 2;8(6):601-606. doi: 10.1080/19490976.2017.1344809. Epub 2017 Jul 13.","Wen SW","Gut Microbes","2017","2017/06/23","PMC5730388","","10.1080/19490976.2017.1344809"
"34116209","Telmisartan induces a specific gut microbiota signature which may mediate its antiobesity effect","Beckmann L, Künstner A, Freschi ML, Huber G, Stölting I, Ibrahim SM, Hirose M, Freitag M, Langan EA, Matschl U, Galuska CE, Fuchs B, Knobloch JK, Busch H, Raasch W.","Pharmacol Res. 2021 Aug;170:105724. doi: 10.1016/j.phrs.2021.105724. Epub 2021 Jun 9.","Beckmann L","Pharmacol Res","2021","2021/06/11","","","10.1016/j.phrs.2021.105724"
"32668581","Gastrointestinal Disorders and Metabolic Syndrome: Dysbiosis as a Key Link and Common Bioactive Dietary Components Useful for their Treatment","De Filippis A, Ullah H, Baldi A, Dacrema M, Esposito C, Garzarella EU, Santarcangelo C, Tantipongpiradet A, Daglia M.","Int J Mol Sci. 2020 Jul 13;21(14):4929. doi: 10.3390/ijms21144929.","De Filippis A","Int J Mol Sci","2020","2020/07/17","PMC7404341","","10.3390/ijms21144929"
"25440054","Specialized metabolites from the microbiome in health and disease","Sharon G, Garg N, Debelius J, Knight R, Dorrestein PC, Mazmanian SK.","Cell Metab. 2014 Nov 4;20(5):719-730. doi: 10.1016/j.cmet.2014.10.016. Epub 2014 Nov 4.","Sharon G","Cell Metab","2014","2014/12/03","PMC4337795","NIHMS665343","10.1016/j.cmet.2014.10.016"
"34389700","Metformin alleviates choline diet-induced TMAO elevation in C57BL/6J mice by influencing gut-microbiota composition and functionality","Su C, Li X, Yang Y, Du Y, Zhang X, Wang L, Hong B.","Nutr Diabetes. 2021 Jul 31;11(1):27. doi: 10.1038/s41387-021-00169-w.","Su C","Nutr Diabetes","2021","2021/08/14","PMC8363624","","10.1038/s41387-021-00169-w"
"34444829","Probiotics Prevent Hypertension in a Murine Model of Systemic Lupus Erythematosus Induced by Toll-Like Receptor 7 Activation","de la Visitación N, Robles-Vera I, Moleón-Moya J, Sánchez M, Jiménez R, Gómez-Guzmán M, González-Correa C, Olivares M, Toral M, Romero M, Duarte J.","Nutrients. 2021 Jul 31;13(8):2669. doi: 10.3390/nu13082669.","de la Visitación N","Nutrients","2021","2021/08/27","PMC8399640","","10.3390/nu13082669"
"31888137","Migraine without Aura and Subclinical Atherosclerosis in Young Females: Is Gut Microbiota to Blame?","Georgescu D, Iurciuc MS, Ionita I, Dragan S, Muntean M, Ancusa OE, Reisz D, Ionita M, Lighezan D.","Medicina (Kaunas). 2019 Dec 16;55(12):786. doi: 10.3390/medicina55120786.","Georgescu D","Medicina (Kaunas)","2019","2020/01/01","PMC6956152","","10.3390/medicina55120786"
"33168600","Long-term instability of the intestinal microbiome is associated with metabolic liver disease, low microbiota diversity, diabetes mellitus and impaired exocrine pancreatic function","Frost F, Kacprowski T, Rühlemann M, Pietzner M, Bang C, Franke A, Nauck M, Völker U, Völzke H, Dörr M, Baumbach J, Sendler M, Schulz C, Mayerle J, Weiss FU, Homuth G, Lerch MM.","Gut. 2021 Mar;70(3):522-530. doi: 10.1136/gutjnl-2020-322753. Epub 2020 Nov 9.","Frost F","Gut","2021","2020/11/10","PMC7873430","","10.1136/gutjnl-2020-322753"
"33192565","Drug Discovery and Development of Novel Therapeutics for Inhibiting TMAO in Models of Atherosclerosis and Diabetes","Steinke I, Ghanei N, Govindarajulu M, Yoo S, Zhong J, Amin RH.","Front Physiol. 2020 Oct 29;11:567899. doi: 10.3389/fphys.2020.567899. eCollection 2020.","Steinke I","Front Physiol","2020","2020/11/16","PMC7658318","","10.3389/fphys.2020.567899"
"30817265","Microglia, the Missing Link in the Brain-Gut-Hypertension Axis","Touyz RM, Camargo LL.","Circ Res. 2019 Mar;124(5):671-673. doi: 10.1161/CIRCRESAHA.119.314718.","Touyz RM","Circ Res","2019","2019/03/01","","","10.1161/CIRCRESAHA.119.314718"
"35093554","Gut microbiome alterations in hereditary angioedema","Cao Y, Kan H, Wang X, Zhi Y.","Ann Allergy Asthma Immunol. 2022 Apr;128(4):451-458.e6. doi: 10.1016/j.anai.2022.01.021. Epub 2022 Jan 31.","Cao Y","Ann Allergy Asthma Immunol","2022","2022/01/30","","","10.1016/j.anai.2022.01.021"
"30946154","Distinct gut microbiota profile in antiretroviral therapy-treated perinatally HIV-infected patients associated with cardiac and inflammatory biomarkers","Sessa L, Reddel S, Manno E, Quagliariello A, Cotugno N, Del Chierico F, Amodio D, Capponi C, Leone F, Bernardi S, Rossi P, Putignani L, Palma P.","AIDS. 2019 May 1;33(6):1001-1011. doi: 10.1097/QAD.0000000000002131.","Sessa L","AIDS","2019","2019/04/05","","","10.1097/QAD.0000000000002131"
"33931880","Gut microbiota contributes to the development of hypertension in a genetic mouse model of systemic lupus erythematosus","de la Visitación N, Robles-Vera I, Toral M, Gómez-Guzmán M, Sánchez M, Moleón J, González-Correa C, Martín-Morales N, O'Valle F, Jiménez R, Romero M, Duarte J.","Br J Pharmacol. 2021 Sep;178(18):3708-3729. doi: 10.1111/bph.15512. Epub 2021 Jun 16.","de la Visitación N","Br J Pharmacol","2021","2021/05/01","","","10.1111/bph.15512"
"28179566","Human and rat gut microbiome composition is maintained following sleep restriction","Zhang SL, Bai L, Goel N, Bailey A, Jang CJ, Bushman FD, Meerlo P, Dinges DF, Sehgal A.","Proc Natl Acad Sci U S A. 2017 Feb 21;114(8):E1564-E1571. doi: 10.1073/pnas.1620673114. Epub 2017 Feb 8.","Zhang SL","Proc Natl Acad Sci U S A","2017","2017/02/10","PMC5338418","","10.1073/pnas.1620673114"
"33879161","Variations in biomarkers of dyslipidemia and dysbiosis during the menstrual cycle: a pilot study in healthy volunteers","Bergström H, Ekström L, Warnqvist A, Bergman P, Björkhem-Bergman L.","BMC Womens Health. 2021 Apr 20;21(1):166. doi: 10.1186/s12905-021-01306-4.","Bergström H","BMC Womens Health","2021","2021/04/21","PMC8058971","","10.1186/s12905-021-01306-4"
"33260799","Cardiac Autonomic Neuropathy: A Progressive Consequence of Chronic Low-Grade Inflammation in Type 2 Diabetes and Related Metabolic Disorders","Bakkar NZ, Dwaib HS, Fares S, Eid AH, Al-Dhaheri Y, El-Yazbi AF.","Int J Mol Sci. 2020 Nov 27;21(23):9005. doi: 10.3390/ijms21239005.","Bakkar NZ","Int J Mol Sci","2020","2020/12/02","PMC7730941","","10.3390/ijms21239005"
"29705499","High salt intake increases plasma trimethylamine N-oxide (TMAO) concentration and produces gut dysbiosis in rats","Bielinska K, Radkowski M, Grochowska M, Perlejewski K, Huc T, Jaworska K, Motooka D, Nakamura S, Ufnal M.","Nutrition. 2018 Oct;54:33-39. doi: 10.1016/j.nut.2018.03.004. Epub 2018 Mar 22.","Bielinska K","Nutrition","2018","2018/04/30","","","10.1016/j.nut.2018.03.004"
"31869283","Transcriptomic signature of gut microbiome-contacting cells in colon of spontaneously hypertensive rats","Yang T, Li H, Oliveira AC, Goel R, Richards EM, Pepine CJ, Raizada MK.","Physiol Genomics. 2020 Mar 1;52(3):121-132. doi: 10.1152/physiolgenomics.00087.2019. Epub 2019 Dec 23.","Yang T","Physiol Genomics","2020","2019/12/24","PMC7099409","","10.1152/physiolgenomics.00087.2019"
"26711739","Role of the Gut Microbiome in Obstructive Sleep Apnea-Induced Hypertension","Durgan DJ, Ganesh BP, Cope JL, Ajami NJ, Phillips SC, Petrosino JF, Hollister EB, Bryan RM Jr.","Hypertension. 2016 Feb;67(2):469-74. doi: 10.1161/HYPERTENSIONAHA.115.06672. Epub 2015 Dec 28.","Durgan DJ","Hypertension","2016","2015/12/30","PMC4713369","NIHMS743030","10.1161/HYPERTENSIONAHA.115.06672"
"32306442","Previous antibiotic use and the development of Kawasaki disease: a matched pair case-control study","Fukazawa M Jr, Fukazawa M, Nanishi E, Nishio H, Ichihara K, Ohga S.","Pediatr Int. 2020 Sep;62(9):1044-1048. doi: 10.1111/ped.14255. Epub 2020 Sep 14.","Fukazawa M Jr","Pediatr Int","2020","2020/04/20","","","10.1111/ped.14255"
"31564708","Changes in Gut Microbiome Structure and Function of Rats with Isoproterenol-Induced Heart Failure","Zheng A, Yi H, Li F, Han L, Yu J, Cheng X, Su H, Hong K, Li J.","Int Heart J. 2019;60(5):1176-1183. doi: 10.1536/ihj.18-194.","Zheng A","Int Heart J","2019","2019/10/01","","","10.1536/ihj.18-194"
"32521456","A critical review on the relationship of herbal medicine, Akkermansia muciniphila, and human health","Bu F, Zhang S, Duan Z, Ding Y, Chen T, Wang R, Feng Z, Shi G, Zhou J, Chen Y.","Biomed Pharmacother. 2020 Aug;128:110352. doi: 10.1016/j.biopha.2020.110352. Epub 2020 Jun 7.","Bu F","Biomed Pharmacother","2020","2020/06/11","","","10.1016/j.biopha.2020.110352"
"35372123","Association Between Gut Dysbiosis and Sepsis-Induced Myocardial Dysfunction in Patients With Sepsis or Septic Shock","Chen Y, Zhang F, Ye X, Hu JJ, Yang X, Yao L, Zhao BC, Deng F, Liu KX.","Front Cell Infect Microbiol. 2022 Mar 14;12:857035. doi: 10.3389/fcimb.2022.857035. eCollection 2022.","Chen Y","Front Cell Infect Microbiol","2022","2022/04/04","PMC8964439","","10.3389/fcimb.2022.857035"
"33375942","Effect of a probiotic on blood pressure in grade 1 hypertension (HYPRO): protocol of a randomized controlled study","Mähler A, Wilck N, Rauch G, Dechend R, Müller DN.","Trials. 2020 Dec 29;21(1):1032. doi: 10.1186/s13063-020-04973-0.","Mähler A","Trials","2020","2020/12/30","PMC7771080","","10.1186/s13063-020-04973-0"
"32146625","Effect of Prebiotic Complex on Gut Microbiota and Endotoxemia in Female Rats with Modeled Heart Failure","Vlasov AA, Shperling MI, Terkin DA, Bystrova OV, Osipov GA, Salikova SP, Grinevich VB.","Bull Exp Biol Med. 2020 Feb;168(4):435-438. doi: 10.1007/s10517-020-04726-8. Epub 2020 Mar 7.","Vlasov AA","Bull Exp Biol Med","2020","2020/03/09","","","10.1007/s10517-020-04726-8"
"34465304","Altered synthesis of genes associated with short-chain fatty acids in the gut of patients with atrial fibrillation","Zhang J, Zuo K, Fang C, Yin X, Liu X, Zhong J, Li K, Li J, Xu L, Yang X.","BMC Genomics. 2021 Aug 31;22(1):634. doi: 10.1186/s12864-021-07944-0.","Zhang J","BMC Genomics","2021","2021/09/01","PMC8406843","","10.1186/s12864-021-07944-0"
"34130208","A rise in Proteobacteria is an indicator of gut-liver axis-mediated nonalcoholic fatty liver disease in high-fructose-fed adult mice","Vasques-Monteiro IML, Silva-Veiga FM, Miranda CS, de Andrade Gonçalves ÉCB, Daleprane JB, Souza-Mello V.","Nutr Res. 2021 Jul;91:26-35. doi: 10.1016/j.nutres.2021.04.008. Epub 2021 May 21.","Vasques-Monteiro IML","Nutr Res","2021","2021/06/15","","","10.1016/j.nutres.2021.04.008"
"33999048","Laminaria japonica polysaccharide prevents high-fat-diet-induced insulin resistance in mice via regulating gut microbiota","Li QM , Zha XQ , Zhang WN , Liu J , Pan LH , Luo JP .","Food Funct. 2021 Jun 21;12(12):5260-5273. doi: 10.1039/d0fo02100h. Epub 2021 May 17.","Li QM","Food Funct","2021","2021/05/17","","","10.1039/d0fo02100h"
"32412785","Lactobacillus reuteri attenuates cardiac injury without lowering cholesterol in low-density lipoprotein receptor-deficient mice fed standard chow","Koppinger MP, Lopez-Pier MA, Skaria R, Harris PR, Konhilas JP.","Am J Physiol Heart Circ Physiol. 2020 Jul 1;319(1):H32-H41. doi: 10.1152/ajpheart.00569.2019. Epub 2020 May 15.","Koppinger MP","Am J Physiol Heart Circ Physiol","2020","2020/05/16","PMC7474440","","10.1152/ajpheart.00569.2019"
"28328981","Dysbiosis and compositional alterations with aging in the gut microbiota of patients with heart failure","Kamo T, Akazawa H, Suda W, Saga-Kamo A, Shimizu Y, Yagi H, Liu Q, Nomura S, Naito AT, Takeda N, Harada M, Toko H, Kumagai H, Ikeda Y, Takimoto E, Suzuki JI, Honda K, Morita H, Hattori M, Komuro I.","PLoS One. 2017 Mar 22;12(3):e0174099. doi: 10.1371/journal.pone.0174099. eCollection 2017.","Kamo T","PLoS One","2017","2017/03/23","PMC5362204","","10.1371/journal.pone.0174099"
"33901711","Gene interaction network to unravel the role of gut bacterial species in cardiovascular diseases: E. coli O157:H7 host-bacterial interaction study","Miryala SK, Anbarasu A, Ramaiah S.","Comput Biol Med. 2021 Jun;133:104417. doi: 10.1016/j.compbiomed.2021.104417. Epub 2021 Apr 21.","Miryala SK","Comput Biol Med","2021","2021/04/26","","","10.1016/j.compbiomed.2021.104417"
"31894240","Impact of Human Immunodeficiency Virus-Related Gut Microbiota Alterations on Metabolic Comorbid Conditions","Gelpi M, Vestad B, Hansen SH, Holm K, Drivsholm N, Goetz A, Kirkby NS, Lindegaard B, Lebech AM, Hoel H, Michelsen AE, Ueland T, Gerstoft J, Lundgren J, Hov JR, Nielsen SD, Trøseid M.","Clin Infect Dis. 2020 Nov 5;71(8):e359-e367. doi: 10.1093/cid/ciz1235.","Gelpi M","Clin Infect Dis","2020","2020/01/03","","","10.1093/cid/ciz1235"
"31537010","The developing gut-lung axis: postnatal growth restriction, intestinal dysbiosis, and pulmonary hypertension in a rodent model","Wedgwood S, Warford C, Agvatisiri SR, Thai PN, Chiamvimonvat N, Kalanetra KM, Lakshminrusimha S, Steinhorn RH, Mills DA, Underwood MA.","Pediatr Res. 2020 Feb;87(3):472-479. doi: 10.1038/s41390-019-0578-2. Epub 2019 Sep 19.","Wedgwood S","Pediatr Res","2020","2019/09/20","PMC7035999","NIHMS1539540","10.1038/s41390-019-0578-2"
"31099039","Dysbiotic gut microbes may contribute to hypertension by limiting vitamin D production","Zuo K, Li J, Xu Q, Hu C, Gao Y, Chen M, Hu R, Liu Y, Chi H, Yin Q, Cao Y, Wang P, Qin Y, Liu X, Zhong J, Cai J, Li K, Yang X.","Clin Cardiol. 2019 Aug;42(8):710-719. doi: 10.1002/clc.23195. Epub 2019 May 28.","Zuo K","Clin Cardiol","2019","2019/05/18","PMC6672427","","10.1002/clc.23195"
"25435420","Behçet's syndrome patients exhibit specific microbiome signature","Consolandi C, Turroni S, Emmi G, Severgnini M, Fiori J, Peano C, Biagi E, Grassi A, Rampelli S, Silvestri E, Centanni M, Cianchi F, Gotti R, Emmi L, Brigidi P, Bizzaro N, De Bellis G, Prisco D, Candela M, D'Elios MM.","Autoimmun Rev. 2015 Apr;14(4):269-76. doi: 10.1016/j.autrev.2014.11.009. Epub 2014 Nov 27.","Consolandi C","Autoimmun Rev","2015","2014/12/02","","","10.1016/j.autrev.2014.11.009"
"31809363","Intestinal Dysbiosis and Markers of Systemic Inflammation in Viscerally and Generally Obese Persons Living With HIV","Gogokhia L, Taur Y, Juluru K, Yagan N, Zhu YS, Pamer E, Glesby MJ.","J Acquir Immune Defic Syndr. 2020 Jan 1;83(1):81-89. doi: 10.1097/QAI.0000000000002229.","Gogokhia L","J Acquir Immune Defic Syndr","2020","2019/12/07","PMC6901102","NIHMS1540953","10.1097/QAI.0000000000002229"
"34887530","Role of the microbiota in hypertension and antihypertensive drug metabolism","Mishima E, Abe T.","Hypertens Res. 2022 Feb;45(2):246-253. doi: 10.1038/s41440-021-00804-0. Epub 2021 Dec 9.","Mishima E","Hypertens Res","2022","2021/12/10","","","10.1038/s41440-021-00804-0"
"27528065","Increased Systolic and Diastolic Blood Pressure Is Associated With Altered Gut Microbiota Composition and Butyrate Production in Early Pregnancy","Gomez-Arango LF, Barrett HL, McIntyre HD, Callaway LK, Morrison M, Dekker Nitert M; SPRING Trial Group.","Hypertension. 2016 Oct;68(4):974-81. doi: 10.1161/HYPERTENSIONAHA.116.07910. Epub 2016 Aug 15.","Gomez-Arango LF","Hypertension","2016","2016/08/17","","","10.1161/HYPERTENSIONAHA.116.07910"
"32681453","Probiotics Supplementation on Cardiac Remodeling Following Myocardial Infarction: a Single-Center Double-Blind Clinical Study","Moludi J, Saiedi S, Ebrahimi B, Alizadeh M, Khajebishak Y, Ghadimi SS.","J Cardiovasc Transl Res. 2021 Apr;14(2):299-307. doi: 10.1007/s12265-020-10052-1. Epub 2020 Jul 17.","Moludi J","J Cardiovasc Transl Res","2021","2020/07/19","","","10.1007/s12265-020-10052-1"
"29620717","The microbial metabolite trimethylamine-N-oxide in association with inflammation and microbial dysregulation in three HIV cohorts at various disease stages","Missailidis C, Neogi U, Stenvinkel P, Trøseid M, Nowak P, Bergman P.","AIDS. 2018 Jul 31;32(12):1589-1598. doi: 10.1097/QAD.0000000000001813.","Missailidis C","AIDS","2018","2018/04/06","","","10.1097/QAD.0000000000001813"
"31090460","Saccharomyces boulardii CNCM I-745 changes lipidemic profile and gut microbiota in a hamster hypercholesterolemic model","Briand F, Sulpice T, Giammarinaro P, Roux X.","Benef Microbes. 2019 May 28;10(5):555-567. doi: 10.3920/BM2018.0134. Epub 2019 May 15.","Briand F","Benef Microbes","2019","2019/05/16","","","10.3920/BM2018.0134"
"32008198","Resistant starch supplementation attenuates inflammation in hemodialysis patients: a pilot study","de Paiva BR, Esgalhado M, Borges NA, Kemp JA, Alves G, Leite PEC, Macedo R, Cardozo LFMF, de Brito JS, Mafra D.","Int Urol Nephrol. 2020 Mar;52(3):549-555. doi: 10.1007/s11255-020-02392-3. Epub 2020 Feb 1.","de Paiva BR","Int Urol Nephrol","2020","2020/02/03","","","10.1007/s11255-020-02392-3"
"31697707","Sildenafil citrate long-term treatment effects on cardiovascular reactivity in a SHR experimental model of metabolic syndrome","Doghri Y, Chetaneau F, Rhimi M, Kriaa A, Lalanne V, Thorin C, Maguin E, Mallem MY, Desfontis JC.","PLoS One. 2019 Nov 7;14(11):e0223914. doi: 10.1371/journal.pone.0223914. eCollection 2019.","Doghri Y","PLoS One","2019","2019/11/08","PMC6837760","","10.1371/journal.pone.0223914"
"33278908","Do we have the guts to go? The abdominal compartment, intra-abdominal hypertension, the human microbiome and exploration class space missions","Kirkpatrick AW, Hamilton DR, McKee JL, MacDonald B, Pelosi P, Ball CG, Roberts D, McBeth PB, Cocolini F, Ansaloni L, Peireira B, Sugrue M, Campbell MR, Kimball EJ, Malbrain MLNG, Roberts D.","Can J Surg. 2020 Nov-Dec;63(6):E581-E593. doi: 10.1503/cjs019219.","Kirkpatrick AW","Can J Surg","2020","2020/12/06","PMC7747844","","10.1503/cjs019219"
"33288164","Lycium barbarum polysaccharide attenuates myocardial injury in high-fat diet-fed mice through manipulating the gut microbiome and fecal metabolome","Zhang Z, Liu H, Yu B, Tao H, Li J, Wu Z, Liu G, Yuan C, Guo L, Cui B.","Food Res Int. 2020 Dec;138(Pt B):109778. doi: 10.1016/j.foodres.2020.109778. Epub 2020 Oct 15.","Zhang Z","Food Res Int","2020","2020/12/08","","","10.1016/j.foodres.2020.109778"
"32251665","Cross-omics analysis revealed gut microbiome-related metabolic pathways underlying atherosclerosis development after antibiotics treatment","Kappel BA, De Angelis L, Heiser M, Ballanti M, Stoehr R, Goettsch C, Mavilio M, Artati A, Paoluzi OA, Adamski J, Mingrone G, Staels B, Burcelin R, Monteleone G, Menghini R, Marx N, Federici M.","Mol Metab. 2020 Jun;36:100976. doi: 10.1016/j.molmet.2020.100976. Epub 2020 Mar 13.","Kappel BA","Mol Metab","2020","2020/04/07","PMC7183232","","10.1016/j.molmet.2020.100976"
"33433816","Immune Dysregulation in Myocardial Fibrosis, Steatosis, and Heart Failure: Current Insights from HIV and the General Population","Sinha A, Feinstein MJ.","Curr HIV/AIDS Rep. 2021 Feb;18(1):63-72. doi: 10.1007/s11904-020-00536-9. Epub 2021 Jan 12.","Sinha A","Curr HIV/AIDS Rep","2021","2021/01/12","","","10.1007/s11904-020-00536-9"
