PMID,Title,Authors,Citation,First Author,Journal/Book,Publication Year,Create Date,PMCID,NIHMS ID,DOI
"33561095","Targeting Gut Microbiota to Treat Hypertension: A Systematic Review","Palmu J, Lahti L, Niiranen T.","Int J Environ Res Public Health. 2021 Jan 30;18(3):1248. doi: 10.3390/ijerph18031248.","Palmu J","Int J Environ Res Public Health","2021","2021/02/09","PMC7908114","","10.3390/ijerph18031248"
"34321175","Gut microbiota-derived short-chain fatty acids and hypertension: Mechanism and treatment","Yang F, Chen H, Gao Y, An N, Li X, Pan X, Yang X, Tian L, Sun J, Xiong X, Xing Y.","Biomed Pharmacother. 2020 Oct;130:110503. doi: 10.1016/j.biopha.2020.110503. Epub 2020 Aug 18.","Yang F","Biomed Pharmacother","2020","2021/07/29","","","10.1016/j.biopha.2020.110503"
"27342212","Loss of Junctional Adhesion Molecule A Promotes Severe Steatohepatitis in Mice on a Diet High in Saturated Fat, Fructose, and Cholesterol","Rahman K, Desai C, Iyer SS, Thorn NE, Kumar P, Liu Y, Smith T, Neish AS, Li H, Tan S, Wu P, Liu X, Yu Y, Farris AB, Nusrat A, Parkos CA, Anania FA.","Gastroenterology. 2016 Oct;151(4):733-746.e12. doi: 10.1053/j.gastro.2016.06.022. Epub 2016 Jun 21.","Rahman K","Gastroenterology","2016","2016/06/26","PMC5037035","NIHMS809686","10.1053/j.gastro.2016.06.022"
"34375351","Characteristics of gut microbiota in people with obesity","Duan M, Wang Y, Zhang Q, Zou R, Guo M, Zheng H.","PLoS One. 2021 Aug 10;16(8):e0255446. doi: 10.1371/journal.pone.0255446. eCollection 2021.","Duan M","PLoS One","2021","2021/08/10","PMC8354443","","10.1371/journal.pone.0255446"
"28654798","The impact of gut microbiota on kidney function and pathogenesis","Mahmoodpoor F, Rahbar Saadat Y, Barzegari A, Ardalan M, Zununi Vahed S.","Biomed Pharmacother. 2017 Sep;93:412-419. doi: 10.1016/j.biopha.2017.06.066. Epub 2017 Jun 24.","Mahmoodpoor F","Biomed Pharmacother","2017","2017/06/28","","","10.1016/j.biopha.2017.06.066"
"34338744","Does gut microbiota affect atrial rhythm? Causalities and speculations","Linz D, Gawałko M, Sanders P, Penders J, Li N, Nattel S, Dobrev D.","Eur Heart J. 2021 Sep 14;42(35):3521-3525. doi: 10.1093/eurheartj/ehab467.","Linz D","Eur Heart J","2021","2021/08/02","PMC8442110","","10.1093/eurheartj/ehab467"
"32030625","HIV, Sexual Orientation, and Gut Microbiome Interactions","Tuddenham S, Koay WL, Sears C.","Dig Dis Sci. 2020 Mar;65(3):800-817. doi: 10.1007/s10620-020-06110-y.","Tuddenham S","Dig Dis Sci","2020","2020/02/08","PMC7301749","NIHMS1558019","10.1007/s10620-020-06110-y"
"34107468","Role of the Gut Microbiota in Stroke Pathogenesis and Potential Therapeutic Implications","Yamashiro K, Kurita N, Urabe T, Hattori N.","Ann Nutr Metab. 2021;77 Suppl 2(Suppl 2):36-44. doi: 10.1159/000516398. Epub 2021 Jun 9.","Yamashiro K","Ann Nutr Metab","2021","2021/06/09","PMC8619778","","10.1159/000516398"
"29045253","Gut microbial diversity in HIV infection post combined antiretroviral therapy: a key target for prevention of cardiovascular disease","El-Far M, Tremblay CL.","Curr Opin HIV AIDS. 2018 Jan;13(1):38-44. doi: 10.1097/COH.0000000000000426.","El-Far M","Curr Opin HIV AIDS","2018","2017/10/19","PMC5718258","","10.1097/COH.0000000000000426"
"29102544","Gut microbiota and hypertension: From pathogenesis to new therapeutic strategies","Kang Y, Cai Y.","Clin Res Hepatol Gastroenterol. 2018 Apr;42(2):110-117. doi: 10.1016/j.clinre.2017.09.006. Epub 2017 Nov 1.","Kang Y","Clin Res Hepatol Gastroenterol","2018","2017/11/06","","","10.1016/j.clinre.2017.09.006"
"28219830","Gut microbiome-based medical methodologies for early-stage disease prevention","Wang JZ, Du WT, Xu YL, Cheng SZ, Liu ZJ.","Microb Pathog. 2017 Apr;105:122-130. doi: 10.1016/j.micpath.2017.02.024. Epub 2017 Feb 20.","Wang JZ","Microb Pathog","2017","2017/02/22","","","10.1016/j.micpath.2017.02.024"
"33206321","The Gut Ecosystem: A Critical Player in Stroke","Delgado Jiménez R, Benakis C.","Neuromolecular Med. 2021 Jun;23(2):236-241. doi: 10.1007/s12017-020-08633-z. Epub 2020 Nov 18.","Delgado Jiménez R","Neuromolecular Med","2021","2020/11/18","PMC8128731","","10.1007/s12017-020-08633-z"
"34970454","The Bidirectional Signal Communication of Microbiota-Gut-Brain Axis in Hypertension","Wang X, Chen Z, Geng B, Cai J.","Int J Hypertens. 2021 Dec 21;2021:8174789. doi: 10.1155/2021/8174789. eCollection 2021.","Wang X","Int J Hypertens","2021","2021/12/31","PMC8714396","","10.1155/2021/8174789"
"34492105","Therapeutic immunoglobulin A antibody for dysbiosis-related diseases","Shinkura R.","Int Immunol. 2021 Nov 25;33(12):787-790. doi: 10.1093/intimm/dxab066.","Shinkura R","Int Immunol","2021","2021/09/07","PMC8499904","","10.1093/intimm/dxab066"
"29133215","Myocardial infarction and gut microbiota: An incidental connection","Zununi Vahed S, Barzegari A, Zuluaga M, Letourneur D, Pavon-Djavid G.","Pharmacol Res. 2018 Mar;129:308-317. doi: 10.1016/j.phrs.2017.11.008. Epub 2017 Nov 10.","Zununi Vahed S","Pharmacol Res","2018","2017/11/15","","","10.1016/j.phrs.2017.11.008"
"29295767","[Micro-inflammation and digestive bacterial translocation in chronic kidney disease]","Olivier V, Dunyach-Remy C, Lavigne JP, Moranne O.","Nephrol Ther. 2018 May;14(3):135-141. doi: 10.1016/j.nephro.2017.10.005. Epub 2017 Dec 30.","Olivier V","Nephrol Ther","2018","2018/01/04","","","10.1016/j.nephro.2017.10.005"
"30847506","[Microbiome, diabetes and heart: a novel link?]","Kappel BA, Lehrke M.","Herz. 2019 May;44(3):223-230. doi: 10.1007/s00059-019-4791-x.","Kappel BA","Herz","2019","2019/03/09","","","10.1007/s00059-019-4791-x"
"33008046","Maternal Adenine-Induced Chronic Kidney Disease Programs Hypertension in Adult Male Rat Offspring: Implications of Nitric Oxide and Gut Microbiome Derived Metabolites","Hsu CN, Yang HW, Hou CY, Chang-Chien GP, Lin S, Tain YL.","Int J Mol Sci. 2020 Sep 30;21(19):7237. doi: 10.3390/ijms21197237.","Hsu CN","Int J Mol Sci","2020","2020/10/03","PMC7583952","","10.3390/ijms21197237"
"34307184","Review: Effect of Gut Microbiota and Its Metabolite SCFAs on Radiation-Induced Intestinal Injury","Li Y, Zhang Y, Wei K, He J, Ding N, Hua J, Zhou T, Niu F, Zhou G, Shi T, Zhang L, Liu Y.","Front Cell Infect Microbiol. 2021 Jul 9;11:577236. doi: 10.3389/fcimb.2021.577236. eCollection 2021.","Li Y","Front Cell Infect Microbiol","2021","2021/07/26","PMC8300561","","10.3389/fcimb.2021.577236"
"34360538","Diabetes Mellitus and Cardiovascular Diseases: Nutraceutical Interventions Related to Caloric Restriction","Senesi P, Ferrulli A, Luzi L, Terruzzi I.","Int J Mol Sci. 2021 Jul 21;22(15):7772. doi: 10.3390/ijms22157772.","Senesi P","Int J Mol Sci","2021","2021/08/07","PMC8345941","","10.3390/ijms22157772"
"33607506","Crosstalk between gut microbiome and immunology in the management of ischemic brain injury","Rahman Z, Dandekar MP.","J Neuroimmunol. 2021 Apr 15;353:577498. doi: 10.1016/j.jneuroim.2021.577498. Epub 2021 Jan 30.","Rahman Z","J Neuroimmunol","2021","2021/02/19","","","10.1016/j.jneuroim.2021.577498"
"34135909","Contribution of Gut Microbiota to Immunological Changes in Alzheimer's Disease","van Olst L, Roks SJM, Kamermans A, Verhaar BJH, van der Geest AM, Muller M, van der Flier WM, de Vries HE.","Front Immunol. 2021 May 31;12:683068. doi: 10.3389/fimmu.2021.683068. eCollection 2021.","van Olst L","Front Immunol","2021","2021/06/17","PMC8200826","","10.3389/fimmu.2021.683068"
"29661926","Disruptions in gut microbial-host co-metabolism and the development of metabolic disorders","Rajani C, Jia W.","Clin Sci (Lond). 2018 Apr 16;132(7):791-811. doi: 10.1042/CS20171328. Print 2018 Apr 16.","Rajani C","Clin Sci (Lond)","2018","2018/04/18","","","10.1042/CS20171328"
"33970546","Gut dysbiosis and clinical phases of pancolitis in patients with ulcerative colitis","Maldonado-Arriaga B, Sandoval-Jiménez S, Rodríguez-Silverio J, Lizeth Alcaráz-Estrada S, Cortés-Espinosa T, Pérez-Cabeza de Vaca R, Licona-Cassani C, Gámez-Valdez JS, Shaw J, Mondragón-Terán P, Hernández-Cortez C, Suárez-Cuenca JA, Castro-Escarpulli G.","Microbiologyopen. 2021 Mar;10(2):e1181. doi: 10.1002/mbo3.1181.","Maldonado-Arriaga B","Microbiologyopen","2021","2021/05/10","PMC8087925","","10.1002/mbo3.1181"
"27565581","The Role of the Gut Microbiome on Chronic Kidney Disease","Sampaio-Maia B, Simões-Silva L, Pestana M, Araujo R, Soares-Silva IJ.","Adv Appl Microbiol. 2016;96:65-94. doi: 10.1016/bs.aambs.2016.06.002. Epub 2016 Jul 18.","Sampaio-Maia B","Adv Appl Microbiol","2016","2016/08/28","","","10.1016/bs.aambs.2016.06.002"
"33399007","Novel insights in the relationship of gut microbiota and coronary artery diseases","Ramírez-Macías I, Orenes-Piñero E, Camelo-Castillo A, Rivera-Caravaca JM, López-García C, Marín F.","Crit Rev Food Sci Nutr. 2021 Jan 5:1-13. doi: 10.1080/10408398.2020.1868397. Online ahead of print.","Ramírez-Macías I","Crit Rev Food Sci Nutr","2021","2021/01/05","","","10.1080/10408398.2020.1868397"
"31730803","Pulmonary hypertension: Pathophysiology beyond the lung","Oliveira AC, Richards EM, Raizada MK.","Pharmacol Res. 2020 Jan;151:104518. doi: 10.1016/j.phrs.2019.104518. Epub 2019 Nov 13.","Oliveira AC","Pharmacol Res","2020","2019/11/16","PMC6981289","NIHMS1546206","10.1016/j.phrs.2019.104518"
"25303894","Far from the eyes, close to the heart: dysbiosis of gut microbiota and cardiovascular consequences","Serino M, Blasco-Baque V, Nicolas S, Burcelin R.","Curr Cardiol Rep. 2014 Nov;16(11):540. doi: 10.1007/s11886-014-0540-1.","Serino M","Curr Cardiol Rep","2014","2014/10/12","PMC4194023","","10.1007/s11886-014-0540-1"
"33399851","Angiotensin-converting enzyme 2 and COVID-19 in cardiorenal diseases","Sharma RK, Li J, Krishnan S, Richards EM, Raizada MK, Mohandas R.","Clin Sci (Lond). 2021 Jan 15;135(1):1-17. doi: 10.1042/CS20200482.","Sharma RK","Clin Sci (Lond)","2021","2021/01/05","PMC7796300","","10.1042/CS20200482"
"32903730","NLR and Intestinal Dysbiosis-Associated Inflammatory Illness: Drivers or Dampers?","Elias-Oliveira J, Leite JA, Pereira ÍS, Guimarães JB, Manso GMDC, Silva JS, Tostes RC, Carlos D.","Front Immunol. 2020 Aug 11;11:1810. doi: 10.3389/fimmu.2020.01810. eCollection 2020.","Elias-Oliveira J","Front Immunol","2020","2020/09/09","PMC7438795","","10.3389/fimmu.2020.01810"
"33562498","Health Benefits of Plant-Based Nutrition: Focus on Beans in Cardiometabolic Diseases","Mullins AP, Arjmandi BH.","Nutrients. 2021 Feb 5;13(2):519. doi: 10.3390/nu13020519.","Mullins AP","Nutrients","2021","2021/02/10","PMC7915747","","10.3390/nu13020519"
"35070008","Gut dysbiosis and systemic inflammation promote cardiomyocyte abnormalities in an experimental model of steatohepatitis","Longo L, Rampelotto PH, Filippi-Chiela E, de Souza VEG, Salvati F, Cerski CT, da Silveira TR, Oliveira CP, Uribe-Cruz C, Álvares-da-Silva MR.","World J Hepatol. 2021 Dec 27;13(12):2052-2070. doi: 10.4254/wjh.v13.i12.2052.","Longo L","World J Hepatol","2021","2022/01/24","PMC8727214","","10.4254/wjh.v13.i12.2052"
"33918284","Beneficial Effects of Phenolic Compounds on Gut Microbiota and Metabolic Syndrome","Kasprzak-Drozd K, Oniszczuk T, Stasiak M, Oniszczuk A.","Int J Mol Sci. 2021 Apr 2;22(7):3715. doi: 10.3390/ijms22073715.","Kasprzak-Drozd K","Int J Mol Sci","2021","2021/04/30","PMC8038165","","10.3390/ijms22073715"
"29702489","What's new in short bowel syndrome?","Billiauws L, Corcos O, Joly F.","Curr Opin Clin Nutr Metab Care. 2018 Jul;21(4):313-318. doi: 10.1097/MCO.0000000000000473.","Billiauws L","Curr Opin Clin Nutr Metab Care","2018","2018/04/28","","","10.1097/MCO.0000000000000473"
"27356233","Alcoholic liver disease: focus on prodromal gut health","Park B, Lee HR, Lee YJ.","J Dig Dis. 2016 Aug;17(8):493-500. doi: 10.1111/1751-2980.12375.","Park B","J Dig Dis","2016","2016/06/30","","","10.1111/1751-2980.12375"
"26886380","Exploring the Microbiome in Heart Failure","Kitai T, Kirsop J, Tang WH.","Curr Heart Fail Rep. 2016 Apr;13(2):103-9. doi: 10.1007/s11897-016-0285-9.","Kitai T","Curr Heart Fail Rep","2016","2016/02/18","PMC4791185","NIHMS761188","10.1007/s11897-016-0285-9"
"34841763","[Dysbiosis of Gut Microbiota in Patients with Post-Stroke Cognitive Impairment]","Feng RJ, Yu Q, Li Y, Feng D, Li YM.","Sichuan Da Xue Xue Bao Yi Xue Ban. 2021 Nov;52(6):966-974. doi: 10.12182/20211160507.","Feng RJ","Sichuan Da Xue Xue Bao Yi Xue Ban","2021","2021/11/29","","","10.12182/20211160507"
"30126689","Diagnostics and therapeutic implications of gut microbiota alterations in cardiometabolic diseases","Schiattarella GG, Sannino A, Esposito G, Perrino C.","Trends Cardiovasc Med. 2019 Apr;29(3):141-147. doi: 10.1016/j.tcm.2018.08.003. Epub 2018 Aug 7.","Schiattarella GG","Trends Cardiovasc Med","2019","2018/08/22","","","10.1016/j.tcm.2018.08.003"
"31705258","The gut microbiome and heart failure: A better gut for a better heart","Branchereau M, Burcelin R, Heymes C.","Rev Endocr Metab Disord. 2019 Dec;20(4):407-414. doi: 10.1007/s11154-019-09519-7.","Branchereau M","Rev Endocr Metab Disord","2019","2019/11/10","","","10.1007/s11154-019-09519-7"
"32031871","Gut microbiome of a porcine model of metabolic syndrome and HF-pEF","O'Donovan AN, Herisson FM, Fouhy F, Ryan PM, Whelan D, Johnson CN, Cluzel G, Ross RP, Stanton C, Caplice NM.","Am J Physiol Heart Circ Physiol. 2020 Mar 1;318(3):H590-H603. doi: 10.1152/ajpheart.00512.2019. Epub 2020 Feb 7.","O'Donovan AN","Am J Physiol Heart Circ Physiol","2020","2020/02/08","","","10.1152/ajpheart.00512.2019"
"28469156","Impaired renal function and dysbiosis of gut microbiota contribute to increased trimethylamine-N-oxide in chronic kidney disease patients","Xu KY, Xia GH, Lu JQ, Chen MX, Zhen X, Wang S, You C, Nie J, Zhou HW, Yin J.","Sci Rep. 2017 May 3;7(1):1445. doi: 10.1038/s41598-017-01387-y.","Xu KY","Sci Rep","2017","2017/05/05","PMC5431124","","10.1038/s41598-017-01387-y"
"27081113","Brain-Gut-Bone Marrow Axis: Implications for Hypertension and Related Therapeutics","Santisteban MM, Kim S, Pepine CJ, Raizada MK.","Circ Res. 2016 Apr 15;118(8):1327-36. doi: 10.1161/CIRCRESAHA.116.307709.","Santisteban MM","Circ Res","2016","2016/04/16","PMC4834860","NIHMS771702","10.1161/CIRCRESAHA.116.307709"
"34212778","The Gut Microbiome of Heart Failure With Preserved Ejection Fraction","Beale AL, O'Donnell JA, Nakai ME, Nanayakkara S, Vizi D, Carter K, Dean E, Ribeiro RV, Yiallourou S, Carrington MJ, Marques FZ, Kaye DM.","J Am Heart Assoc. 2021 Jul 6;10(13):e020654. doi: 10.1161/JAHA.120.020654. Epub 2021 Jul 2.","Beale AL","J Am Heart Assoc","2021","2021/07/02","PMC8403331","","10.1161/JAHA.120.020654"
"29286050","Nonalcoholic fatty liver disease and chronic vascular complications of diabetes mellitus","Targher G, Lonardo A, Byrne CD.","Nat Rev Endocrinol. 2018 Feb;14(2):99-114. doi: 10.1038/nrendo.2017.173. Epub 2017 Dec 29.","Targher G","Nat Rev Endocrinol","2018","2017/12/30","","","10.1038/nrendo.2017.173"
"29895255","GUT Microbiome-GUT Dysbiosis-Arterial Hypertension: New Horizons","Katsi V, Didagelos M, Skevofilax S, Armenis I, Kartalis A, Vlachopoulos C, Karvounis H, Tousoulis D.","Curr Hypertens Rev. 2019;15(1):40-46. doi: 10.2174/1573402114666180613080439.","Katsi V","Curr Hypertens Rev","2019","2018/06/14","","","10.2174/1573402114666180613080439"
"31023366","The role of the gut microbiome in sex differences in arterial pressure","Beale AL, Kaye DM, Marques FZ.","Biol Sex Differ. 2019 Apr 25;10(1):22. doi: 10.1186/s13293-019-0236-8.","Beale AL","Biol Sex Differ","2019","2019/04/27","PMC6485140","","10.1186/s13293-019-0236-8"
"30282443","Histopathology of the gut in rheumatic diseases","Macaluso F, Guggino G, Rizzo A, Ferrante A, Ciccia F.","Reumatismo. 2018 Oct 3;70(3):178-186. doi: 10.4081/reumatismo.2018.1084.","Macaluso F","Reumatismo","2018","2018/10/05","","","10.4081/reumatismo.2018.1084"
"32023431","Gut microbiota and neuroinflammation in pathogenesis of hypertension: A potential role for hydrogen sulfide","Donertas Ayaz B, Zubcevic J.","Pharmacol Res. 2020 Mar;153:104677. doi: 10.1016/j.phrs.2020.104677. Epub 2020 Feb 2.","Donertas Ayaz B","Pharmacol Res","2020","2020/02/06","PMC7056572","NIHMS1563008","10.1016/j.phrs.2020.104677"
"34453990","Curcumin ameliorates hypertension via gut-brain communication in spontaneously hypertensive rat","Li HB, Xu ML, Du MM, Yu XJ, Bai J, Xia WJ, Dai ZM, Li CX, Li Y, Su Q, Wang XM, Dong YY, Kang YM.","Toxicol Appl Pharmacol. 2021 Oct 15;429:115701. doi: 10.1016/j.taap.2021.115701. Epub 2021 Aug 25.","Li HB","Toxicol Appl Pharmacol","2021","2021/08/28","","","10.1016/j.taap.2021.115701"
"27834801","Trimethylamine N-Oxide: The Good, the Bad and the Unknown","Velasquez MT, Ramezani A, Manal A, Raj DS.","Toxins (Basel). 2016 Nov 8;8(11):326. doi: 10.3390/toxins8110326.","Velasquez MT","Toxins (Basel)","2016","2016/11/12","PMC5127123","","10.3390/toxins8110326"
"33567710","Nutritional Approach Targeting Gut Microbiota in NAFLD-To Date","Moszak M, Szulińska M, Walczak-Gałęzewska M, Bogdański P.","Int J Environ Res Public Health. 2021 Feb 8;18(4):1616. doi: 10.3390/ijerph18041616.","Moszak M","Int J Environ Res Public Health","2021","2021/02/11","PMC7916007","","10.3390/ijerph18041616"
"34371800","Cardiovascular Diseases of Developmental Origins: Preventive Aspects of Gut Microbiota-Targeted Therapy","Hsu CN, Hou CY, Hsu WH, Tain YL.","Nutrients. 2021 Jul 1;13(7):2290. doi: 10.3390/nu13072290.","Hsu CN","Nutrients","2021","2021/08/10","PMC8308390","","10.3390/nu13072290"
"34611194","NEIL3-deficiency increases gut permeability and contributes to a pro-atherogenic metabolic phenotype","Karlsen TR, Kong XY, Holm S, Quiles-Jiménez A, Dahl TB, Yang K, Sagen EL, Skarpengland T, S Øgaard JD, Holm K, Vestad B, Olsen MB, Aukrust P, Bjørås M, Hov JR, Halvorsen B, Gregersen I.","Sci Rep. 2021 Oct 5;11(1):19749. doi: 10.1038/s41598-021-98820-0.","Karlsen TR","Sci Rep","2021","2021/10/06","PMC8492623","","10.1038/s41598-021-98820-0"
"33795775","Transverse aortic constriction induces gut barrier alterations, microbiota remodeling and systemic inflammation","Boccella N, Paolillo R, Coretti L, D'Apice S, Lama A, Giugliano G, Schiattarella GG, Cuomo M, d'Aquino I, Cavaliere G, Paciello O, Mollica MP, Mattace Raso G, Esposito G, Lembo F, Perrino C.","Sci Rep. 2021 Apr 1;11(1):7404. doi: 10.1038/s41598-021-86651-y.","Boccella N","Sci Rep","2021","2021/04/02","PMC8016915","","10.1038/s41598-021-86651-y"
"33803899","Thrombolome and Its Emerging Role in Chronic Kidney Diseases","Fryc J, Naumnik B.","Toxins (Basel). 2021 Mar 18;13(3):223. doi: 10.3390/toxins13030223.","Fryc J","Toxins (Basel)","2021","2021/04/03","PMC8003125","","10.3390/toxins13030223"
"30069677","Microbiota issue in CKD: how promising are gut-targeted approaches?","Cosola C, Rocchetti MT, Sabatino A, Fiaccadori E, Di Iorio BR, Gesualdo L.","J Nephrol. 2019 Feb;32(1):27-37. doi: 10.1007/s40620-018-0516-0. Epub 2018 Aug 1.","Cosola C","J Nephrol","2019","2018/08/03","","","10.1007/s40620-018-0516-0"
"24479734","The human microbiome and bile acid metabolism: dysbiosis, dysmetabolism, disease and intervention","Jones ML, Martoni CJ, Ganopolsky JG, Labbé A, Prakash S.","Expert Opin Biol Ther. 2014 Apr;14(4):467-82. doi: 10.1517/14712598.2014.880420. Epub 2014 Jan 30.","Jones ML","Expert Opin Biol Ther","2014","2014/02/01","","","10.1517/14712598.2014.880420"
"32841652","Regulating metabolic inflammation by nutritional modulation","Charles-Messance H, Mitchelson KAJ, De Marco Castro E, Sheedy FJ, Roche HM.","J Allergy Clin Immunol. 2020 Oct;146(4):706-720. doi: 10.1016/j.jaci.2020.08.013. Epub 2020 Aug 22.","Charles-Messance H","J Allergy Clin Immunol","2020","2020/08/26","","","10.1016/j.jaci.2020.08.013"
"31100620","Effects of dietary intervention and n-3 PUFA supplementation on markers of gut-related inflammation and their association with cardiovascular events in a high-risk population","Awoyemi A, Trøseid M, Arnesen H, Solheim S, Seljeflot I.","Atherosclerosis. 2019 Jul;286:53-59. doi: 10.1016/j.atherosclerosis.2019.05.004. Epub 2019 May 4.","Awoyemi A","Atherosclerosis","2019","2019/05/18","","","10.1016/j.atherosclerosis.2019.05.004"
"28921469","Microbial Factors in Inflammatory Diseases and Cancers","Ong HS, Yim HCH.","Adv Exp Med Biol. 2017;1024:153-174. doi: 10.1007/978-981-10-5987-2_7.","Ong HS","Adv Exp Med Biol","2017","2017/09/19","","","10.1007/978-981-10-5987-2_7"
"34069405","Dysbiosis-Related Advanced Glycation Endproducts and Trimethylamine N-Oxide in Chronic Kidney Disease","Taguchi K, Fukami K, Elias BC, Brooks CR.","Toxins (Basel). 2021 May 19;13(5):361. doi: 10.3390/toxins13050361.","Taguchi K","Toxins (Basel)","2021","2021/06/02","PMC8158751","","10.3390/toxins13050361"
"32131606","Gut microbiota in surgical and critically ill patients","Ho KM, Kalgudi S, Corbett JM, Litton E.","Anaesth Intensive Care. 2020 May;48(3):179-195. doi: 10.1177/0310057X20903732. Epub 2020 Mar 4.","Ho KM","Anaesth Intensive Care","2020","2020/03/06","","","10.1177/0310057X20903732"
"28429701","[Microbiota and metabolic syndrome]","Altuntaş Y, Batman A.","Turk Kardiyol Dern Ars. 2017 Apr;45(3):286-296. doi: 10.5543/tkda.2016.72461.","Altuntaş Y","Turk Kardiyol Dern Ars","2017","2017/04/22","","","10.5543/tkda.2016.72461"
"32737524","Gut microbiota and atherosclerosis: role of B cell for atherosclerosis focusing on the gut-immune-B2 cell axis","Chen L, Ishigami T, Doi H, Arakawa K, Tamura K.","J Mol Med (Berl). 2020 Sep;98(9):1235-1244. doi: 10.1007/s00109-020-01936-5. Epub 2020 Jul 31.","Chen L","J Mol Med (Berl)","2020","2020/08/02","PMC7447622","","10.1007/s00109-020-01936-5"
"33809061","Molecular Mechanisms of Obesity-Linked Cardiac Dysfunction: An Up-Date on Current Knowledge","Gutiérrez-Cuevas J, Sandoval-Rodriguez A, Meza-Rios A, Monroy-Ramírez HC, Galicia-Moreno M, García-Bañuelos J, Santos A, Armendariz-Borunda J.","Cells. 2021 Mar 12;10(3):629. doi: 10.3390/cells10030629.","Gutiérrez-Cuevas J","Cells","2021","2021/04/03","PMC8000147","","10.3390/cells10030629"
"34840258","Vasodilator Dysfunction in Human Obesity: Established and Emerging Mechanisms","Schinzari F, Tesauro M, Cardillo C.","J Cardiovasc Pharmacol. 2021 Dec 1;78(Suppl 6):S40-S52. doi: 10.1097/FJC.0000000000001108.","Schinzari F","J Cardiovasc Pharmacol","2021","2021/11/29","","","10.1097/FJC.0000000000001108"
"32328074","The Bacterium Akkermansia muciniphila: A Sentinel for Gut Permeability and Its Relevance to HIV-Related Inflammation","Ouyang J, Lin J, Isnard S, Fombuena B, Peng X, Marette A, Routy B, Messaoudene M, Chen Y, Routy JP.","Front Immunol. 2020 Apr 9;11:645. doi: 10.3389/fimmu.2020.00645. eCollection 2020.","Ouyang J","Front Immunol","2020","2020/04/25","PMC7160922","","10.3389/fimmu.2020.00645"
"26322922","ACE2 and Microbiota: Emerging Targets for Cardiopulmonary Disease Therapy","Cole-Jeffrey CT, Liu M, Katovich MJ, Raizada MK, Shenoy V.","J Cardiovasc Pharmacol. 2015 Dec;66(6):540-50. doi: 10.1097/FJC.0000000000000307.","Cole-Jeffrey CT","J Cardiovasc Pharmacol","2015","2015/09/01","PMC4807023","NIHMS717336","10.1097/FJC.0000000000000307"
"32352513","Gut microbiota in coronary artery disease: a friend or foe?","Zhang B, Wang X, Xia R, Li C.","Biosci Rep. 2020 May 29;40(5):BSR20200454. doi: 10.1042/BSR20200454.","Zhang B","Biosci Rep","2020","2020/05/01","PMC7225411","","10.1042/BSR20200454"
"32405173","Linking gut microbiota with the human diseases","Vandana UK, Barlaskar NH, Gulzar ABM, Laskar IH, Kumar D, Paul P, Pandey P, Mazumder PB.","Bioinformation. 2020 Feb 29;16(2):196-208. doi: 10.6026/97320630016196. eCollection 2020.","Vandana UK","Bioinformation","2020","2020/05/15","PMC7196170","","10.6026/97320630016196"
"30835680","Spinal cord injury and the human microbiome: beyond the brain-gut axis","Wallace DJ, Sayre NL, Patterson TT, Nicholson SE, Hilton D, Grandhi R.","Neurosurg Focus. 2019 Mar 1;46(3):E11. doi: 10.3171/2018.12.FOCUS18206.","Wallace DJ","Neurosurg Focus","2019","2019/03/06","","","10.3171/2018.12.FOCUS18206"
"29523750","Altered microbiome in chronic kidney disease: systemic effects of gut-derived uremic toxins","Lau WL, Savoj J, Nakata MB, Vaziri ND.","Clin Sci (Lond). 2018 Mar 9;132(5):509-522. doi: 10.1042/CS20171107. Print 2018 Mar 15.","Lau WL","Clin Sci (Lond)","2018","2018/03/11","","","10.1042/CS20171107"
"30482503","The Role of Microbiota in Cardiovascular Risk: Focus on Trimethylamine Oxide","Al-Rubaye H, Perfetti G, Kaski JC.","Curr Probl Cardiol. 2019 Jun;44(6):182-196. doi: 10.1016/j.cpcardiol.2018.06.005. Epub 2018 Jul 7.","Al-Rubaye H","Curr Probl Cardiol","2019","2018/11/29","","","10.1016/j.cpcardiol.2018.06.005"
"30192713","Dysbiosis signatures of gut microbiota in coronary artery disease","Zhu Q, Gao R, Zhang Y, Pan D, Zhu Y, Zhang X, Yang R, Jiang R, Xu Y, Qin H.","Physiol Genomics. 2018 Oct 1;50(10):893-903. doi: 10.1152/physiolgenomics.00070.2018. Epub 2018 Sep 7.","Zhu Q","Physiol Genomics","2018","2018/09/08","","","10.1152/physiolgenomics.00070.2018"
"34747187","Intermittent Fasting Enhances Right Ventricular Function in Preclinical Pulmonary Arterial Hypertension","Prisco SZ, Eklund M, Moutsoglou DM, Prisco AR, Khoruts A, Weir EK, Thenappan T, Prins KW.","J Am Heart Assoc. 2021 Nov 16;10(22):e022722. doi: 10.1161/JAHA.121.022722. Epub 2021 Nov 8.","Prisco SZ","J Am Heart Assoc","2021","2021/11/08","PMC8751945","","10.1161/JAHA.121.022722"
"33375200","Effects of Gut Metabolites and Microbiota in Healthy and Marginal Livers Submitted to Surgery","Micó-Carnero M, Rojano-Alfonso C, Álvarez-Mercado AI, Gracia-Sancho J, Casillas-Ramírez A, Peralta C.","Int J Mol Sci. 2020 Dec 22;22(1):44. doi: 10.3390/ijms22010044.","Micó-Carnero M","Int J Mol Sci","2020","2020/12/30","PMC7793124","","10.3390/ijms22010044"
"31501492","Defining Dysbiosis for a Cluster of Chronic Diseases","Wilkins LJ, Monga M, Miller AW.","Sci Rep. 2019 Sep 9;9(1):12918. doi: 10.1038/s41598-019-49452-y.","Wilkins LJ","Sci Rep","2019","2019/09/11","PMC6733864","","10.1038/s41598-019-49452-y"
