PMID,Title,Authors,Citation,First Author,Journal/Book,Publication Year,Create Date,PMCID,NIHMS ID,DOI
"25345506","Implication of gut microbiota in human health","Khan I, Yasir M, Azhar EI, Kumosani T, Barbour EK, Bibi F, Kamal MA.","CNS Neurol Disord Drug Targets. 2014;13(8):1325-33. doi: 10.2174/1871527313666141023153506.","Khan I","CNS Neurol Disord Drug Targets","2014","2014/10/28","","","10.2174/1871527313666141023153506"
"32235412","Soybean Oil Modulates the Gut Microbiota Associated with Atherogenic Biomarkers","Korach-Rechtman H, Rom O, Mazouz L, Freilich S, Jeries H, Hayek T, Aviram M, Kashi Y.","Microorganisms. 2020 Mar 30;8(4):486. doi: 10.3390/microorganisms8040486.","Korach-Rechtman H","Microorganisms","2020","2020/04/03","PMC7232217","","10.3390/microorganisms8040486"
"35395844","Altered gut microbiota and its association with inflammation in patients with chronic thromboembolic pulmonary hypertension: a single-center observational study in Japan","Ikubo Y, Sanada TJ, Hosomi K, Park J, Naito A, Shoji H, Misawa T, Suda R, Sekine A, Sugiura T, Shigeta A, Nanri H, Sakao S, Tanabe N, Mizuguchi K, Kunisawa J, Suzuki T, Tatsumi K.","BMC Pulm Med. 2022 Apr 8;22(1):138. doi: 10.1186/s12890-022-01932-0.","Ikubo Y","BMC Pulm Med","2022","2022/04/09","PMC8994357","","10.1186/s12890-022-01932-0"
"31749437","Childhood Hypertension and Effects on Cognitive Functions: Mechanisms and Future Perspectives","Tyner E, Oropeza M, Figueroa J, Peña ICD.","CNS Neurol Disord Drug Targets. 2019;18(9):677-686. doi: 10.2174/1871527318666191017155442.","Tyner E","CNS Neurol Disord Drug Targets","2019","2019/11/22","","","10.2174/1871527318666191017155442"
"22315672","Is the gut microbiota a new factor contributing to obesity and its metabolic disorders?","Harris K, Kassis A, Major G, Chou CJ.","J Obes. 2012;2012:879151. doi: 10.1155/2012/879151. Epub 2012 Jan 24.","Harris K","J Obes","2012","2012/02/09","PMC3270440","","10.1155/2012/879151"
"33382364","Antihypertensive effects of exercise involve reshaping of gut microbiota and improvement of gut-brain axis in spontaneously hypertensive rat","Xia WJ, Xu ML, Yu XJ, Du MM, Li XH, Yang T, Li L, Li Y, Kang KB, Su Q, Xu JX, Shi XL, Wang XM, Li HB, Kang YM.","Gut Microbes. 2021 Jan-Dec;13(1):1-24. doi: 10.1080/19490976.2020.1854642.","Xia WJ","Gut Microbes","2021","2020/12/31","PMC7781639","","10.1080/19490976.2020.1854642"
"31004464","Role of the immune system in vascular function and blood pressure control induced by faecal microbiota transplantation in rats","Toral M, Robles-Vera I, de la Visitación N, Romero M, Sánchez M, Gómez-Guzmán M, Rodriguez-Nogales A, Yang T, Jiménez R, Algieri F, Gálvez J, Raizada MK, Duarte J.","Acta Physiol (Oxf). 2019 Sep;227(1):e13285. doi: 10.1111/apha.13285. Epub 2019 Jun 2.","Toral M","Acta Physiol (Oxf)","2019","2019/04/21","","","10.1111/apha.13285"
"34852816","Effect of gut microbiota from Henoch-Schönlein Purpura patients on acid-sensitive ion channel 3 expression and intestinal motility in germ-free rats","Wang JK, Yan B, Zhao JM, Yuan LP.","BMC Pediatr. 2021 Dec 1;21(1):536. doi: 10.1186/s12887-021-03013-3.","Wang JK","BMC Pediatr","2021","2021/12/02","PMC8638173","","10.1186/s12887-021-03013-3"
"34422393","A discussion of the gut microbiome's development, determinants, and dysbiosis in cancers of the esophagus and stomach","Grover K, Gregory S, Gibbs JF, Emenaker NJ.","J Gastrointest Oncol. 2021 Jul;12(Suppl 2):S290-S300. doi: 10.21037/jgo-2019-gi-07.","Grover K","J Gastrointest Oncol","2021","2021/08/23","PMC8343086","","10.21037/jgo-2019-gi-07"
"25499101","Circadian rhythms, alcohol and gut interactions","Forsyth CB, Voigt RM, Burgess HJ, Swanson GR, Keshavarzian A.","Alcohol. 2015 Jun;49(4):389-98. doi: 10.1016/j.alcohol.2014.07.021. Epub 2014 Nov 14.","Forsyth CB","Alcohol","2015","2014/12/16","PMC4431951","NIHMS649264","10.1016/j.alcohol.2014.07.021"
"34371955","Administration with Quinoa Protein Reduces the Blood Pressure in Spontaneously Hypertensive Rats and Modifies the Fecal Microbiota","Guo H, Hao Y, Fan X, Richel A, Everaert N, Yang X, Ren G.","Nutrients. 2021 Jul 17;13(7):2446. doi: 10.3390/nu13072446.","Guo H","Nutrients","2021","2021/08/10","PMC8308759","","10.3390/nu13072446"
"28315049","Antihypertensive Effects of Probiotics","Robles-Vera I, Toral M, Romero M, Jiménez R, Sánchez M, Pérez-Vizcaíno F, Duarte J.","Curr Hypertens Rep. 2017 Apr;19(4):26. doi: 10.1007/s11906-017-0723-4.","Robles-Vera I","Curr Hypertens Rep","2017","2017/03/19","","","10.1007/s11906-017-0723-4"
"33983475","Trimethylamine N-Oxide, a Gut Microbiota-Derived Metabolite, Is Associated with Cardiovascular Risk in Psoriasis: A Cross-Sectional Pilot Study","Sikora M, Kiss N, Stec A, Giebultowicz J, Samborowska E, Jazwiec R, Dadlez M, Olszewska M, Rudnicka L.","Dermatol Ther (Heidelb). 2021 Aug;11(4):1277-1289. doi: 10.1007/s13555-021-00547-3. Epub 2021 May 13.","Sikora M","Dermatol Ther (Heidelb)","2021","2021/05/13","PMC8322249","","10.1007/s13555-021-00547-3"
"33453294","Microbiota thrombus colonization may influence athero-thrombosis in hyperglycemic patients with ST segment elevation myocardialinfarction (STEMI). Marianella study","Sardu C, Consiglia Trotta M, Santella B, D'Onofrio N, Barbieri M, Rizzo MR, Sasso FC, Scisciola L, Turriziani F, Torella M, Portoghese M, Loreni F, Mureddu S, Lepore MA, Galdiero M, Franci G, Folliero V, Petrillo A, Boatti L, Minicucci F, Mauro C, Calabrò P, Feo M, Balestrieri ML, Ercolini D, D'Amico M, Paolisso G, Galdiero M, Marfella R.","Diabetes Res Clin Pract. 2021 Mar;173:108670. doi: 10.1016/j.diabres.2021.108670. Epub 2021 Jan 14.","Sardu C","Diabetes Res Clin Pract","2021","2021/01/16","","","10.1016/j.diabres.2021.108670"
"32070720","Pre-Eclampsia: Microbiota possibly playing a role","Ahmadian E, Rahbar Saadat Y, Hosseiniyan Khatibi SM, Nariman-Saleh-Fam Z, Bastami M, Zununi Vahed F, Ardalan M, Zununi Vahed S.","Pharmacol Res. 2020 May;155:104692. doi: 10.1016/j.phrs.2020.104692. Epub 2020 Feb 15.","Ahmadian E","Pharmacol Res","2020","2020/02/20","","","10.1016/j.phrs.2020.104692"
"29867803","Shifts on Gut Microbiota Associated to Mediterranean Diet Adherence and Specific Dietary Intakes on General Adult Population","Garcia-Mantrana I, Selma-Royo M, Alcantara C, Collado MC.","Front Microbiol. 2018 May 7;9:890. doi: 10.3389/fmicb.2018.00890. eCollection 2018.","Garcia-Mantrana I","Front Microbiol","2018","2018/06/06","PMC5949328","","10.3389/fmicb.2018.00890"
"33374597","Does Gut-Microbiome Interaction Protect against Obesity and Obesity-Associated Metabolic Disorders?","Zawada A, Rychter AM, Ratajczak AE, Lisiecka-Masian A, Dobrowolska A, Krela-Kaźmierczak I.","Microorganisms. 2020 Dec 23;9(1):18. doi: 10.3390/microorganisms9010018.","Zawada A","Microorganisms","2020","2020/12/30","PMC7822472","","10.3390/microorganisms9010018"
"32269525","Traditional Chinese Medicine Formula Kang Shuai Lao Pian Improves Obesity, Gut Dysbiosis, and Fecal Metabolic Disorders in High-Fat Diet-Fed Mice","Gong S, Ye T, Wang M, Wang M, Li Y, Ma L, Yang Y, Wang Y, Zhao X, Liu L, Yang M, Chen H, Qian J.","Front Pharmacol. 2020 Mar 25;11:297. doi: 10.3389/fphar.2020.00297. eCollection 2020.","Gong S","Front Pharmacol","2020","2020/04/10","PMC7109517","","10.3389/fphar.2020.00297"
"27105322","Bifidobacteria Abundance-Featured Gut Microbiota Compositional Change in Patients with Behcet's Disease","Shimizu J, Kubota T, Takada E, Takai K, Fujiwara N, Arimitsu N, Ueda Y, Wakisaka S, Suzuki T, Suzuki N.","PLoS One. 2016 Apr 22;11(4):e0153746. doi: 10.1371/journal.pone.0153746. eCollection 2016.","Shimizu J","PLoS One","2016","2016/04/23","PMC4841557","","10.1371/journal.pone.0153746"
"31272315","Examining the Role of the Microbiota-Gut-Brain Axis in Stroke","Durgan DJ, Lee J, McCullough LD, Bryan RM Jr.","Stroke. 2019 Aug;50(8):2270-2277. doi: 10.1161/STROKEAHA.119.025140. Epub 2019 Jul 5.","Durgan DJ","Stroke","2019","2019/07/06","PMC6646086","NIHMS1532209","10.1161/STROKEAHA.119.025140"
"35371048","The Insider: Impact of the Gut Microbiota on Cancer Immunity and Response to Therapies in Multiple Myeloma","Brevi A, Cogrossi LL, Lorenzoni M, Mattorre B, Bellone M.","Front Immunol. 2022 Mar 17;13:845422. doi: 10.3389/fimmu.2022.845422. eCollection 2022.","Brevi A","Front Immunol","2022","2022/04/04","PMC8968065","","10.3389/fimmu.2022.845422"
"31607907","Butyrate Improves the Metabolic Disorder and Gut Microbiome Dysbiosis in Mice Induced by a High-Fat Diet","Gao F, Lv YW, Long J, Chen JM, He JM, Ruan XZ, Zhu HB.","Front Pharmacol. 2019 Sep 13;10:1040. doi: 10.3389/fphar.2019.01040. eCollection 2019.","Gao F","Front Pharmacol","2019","2019/10/15","PMC6761375","","10.3389/fphar.2019.01040"
"35281938","Canagliflozin Prevents Lipid Accumulation, Mitochondrial Dysfunction, and Gut Microbiota Dysbiosis in Mice With Diabetic Cardiovascular Disease","Wang X, Wang Z, Liu D, Jiang H, Cai C, Li G, Yu G.","Front Pharmacol. 2022 Feb 23;13:839640. doi: 10.3389/fphar.2022.839640. eCollection 2022.","Wang X","Front Pharmacol","2022","2022/03/14","PMC8905428","","10.3389/fphar.2022.839640"
"35003127","Gut Microbiota and Acute Central Nervous System Injury: A New Target for Therapeutic Intervention","Yuan B, Lu XJ, Wu Q.","Front Immunol. 2021 Dec 24;12:800796. doi: 10.3389/fimmu.2021.800796. eCollection 2021.","Yuan B","Front Immunol","2021","2022/01/10","PMC8740048","","10.3389/fimmu.2021.800796"
"30714619","Suppression of the gut microbiome ameliorates age-related arterial dysfunction and oxidative stress in mice","Brunt VE, Gioscia-Ryan RA, Richey JJ, Zigler MC, Cuevas LM, Gonzalez A, Vázquez-Baeza Y, Battson ML, Smithson AT, Gilley AD, Ackermann G, Neilson AP, Weir T, Davy KP, Knight R, Seals DR.","J Physiol. 2019 May;597(9):2361-2378. doi: 10.1113/JP277336. Epub 2019 Feb 27.","Brunt VE","J Physiol","2019","2019/02/05","PMC6487935","","10.1113/JP277336"
"33967216","Enterococcus faecalis contributes to hypertension and renal injury in Sprague-Dawley rats by disturbing lipid metabolism","Zhu Y, Liu Y, Wu C, Li H, Du H, Yu H, Huang C, Chen Y, Wang W, Zhu Q, Wang L.","J Hypertens. 2021 Jun 1;39(6):1112-1124. doi: 10.1097/HJH.0000000000002767.","Zhu Y","J Hypertens","2021","2021/05/10","","","10.1097/HJH.0000000000002767"
"35196976","Gut Microbiota Modulation for Therapeutic Management of Various Diseases: A New Perspective Using Stem Cell Therapy","Ahmed LA, Massri KFA.","Curr Mol Pharmacol. 2022 Feb 22. doi: 10.2174/1874467215666220222105004. Online ahead of print.","Ahmed LA","Curr Mol Pharmacol","2022","2022/02/24","","","10.2174/1874467215666220222105004"
"34572600","Common Metabolites in Two Different Hypertensive Mouse Models: A Serum and Urine Metabolome Study","Baranwal G, Pilla R, Goodlett BL, Coleman AK, Arenaz CM, Jayaraman A, Rutkowski JM, Alaniz RC, Mitchell BM.","Biomolecules. 2021 Sep 21;11(9):1387. doi: 10.3390/biom11091387.","Baranwal G","Biomolecules","2021","2021/09/28","PMC8467937","","10.3390/biom11091387"
"30656835","Impaired butyrate absorption in the proximal colon, low serum butyrate and diminished central effects of butyrate on blood pressure in spontaneously hypertensive rats","Yang T, Magee KL, Colon-Perez LM, Larkin R, Liao YS, Balazic E, Cowart JR, Arocha R, Redler T, Febo M, Vickroy T, Martyniuk CJ, Reznikov LR, Zubcevic J.","Acta Physiol (Oxf). 2019 Jun;226(2):e13256. doi: 10.1111/apha.13256. Epub 2019 Feb 20.","Yang T","Acta Physiol (Oxf)","2019","2019/01/19","PMC7199780","NIHMS1065411","10.1111/apha.13256"
"32149275","Macrophages in obesity and non-alcoholic fatty liver disease: Crosstalk with metabolism","Lefere S, Tacke F.","JHEP Rep. 2019 Feb 23;1(1):30-43. doi: 10.1016/j.jhepr.2019.02.004. eCollection 2019 May.","Lefere S","JHEP Rep","2019","2020/03/10","PMC7052781","","10.1016/j.jhepr.2019.02.004"
"35193549","The role of lipopolysaccharides in diabetic retinopathy","Qin X, Zou H.","BMC Ophthalmol. 2022 Feb 22;22(1):86. doi: 10.1186/s12886-022-02296-z.","Qin X","BMC Ophthalmol","2022","2022/02/23","PMC8862382","","10.1186/s12886-022-02296-z"
"29733457","Age-related changes in the gut microbiota influence systemic inflammation and stroke outcome","Spychala MS, Venna VR, Jandzinski M, Doran SJ, Durgan DJ, Ganesh BP, Ajami NJ, Putluri N, Graf J, Bryan RM, McCullough LD.","Ann Neurol. 2018 Jul;84(1):23-36. doi: 10.1002/ana.25250. Epub 2018 Jul 18.","Spychala MS","Ann Neurol","2018","2018/05/08","PMC6119509","NIHMS964901","10.1002/ana.25250"
"31576489","The gut microbiota and its relationship with chronic kidney disease","Plata C, Cruz C, Cervantes LG, Ramírez V.","Int Urol Nephrol. 2019 Dec;51(12):2209-2226. doi: 10.1007/s11255-019-02291-2. Epub 2019 Oct 1.","Plata C","Int Urol Nephrol","2019","2019/10/03","","","10.1007/s11255-019-02291-2"
"33547879","Altered Gut Microbiota is Involved in the Anti-Hypertensive Effects of Vitamin C in Spontaneously Hypertensive Rat","Li Y, Salih Ibrahim RM, Chi HL, Xiao T, Xia WJ, Li HB, Kang YM.","Mol Nutr Food Res. 2021 Apr;65(7):e2000885. doi: 10.1002/mnfr.202000885. Epub 2021 Feb 25.","Li Y","Mol Nutr Food Res","2021","2021/02/06","","","10.1002/mnfr.202000885"
"34681030","The Origin of Plasma-Derived Bacterial Extracellular Vesicles in Healthy Individuals and Patients with Inflammatory Bowel Disease: A Pilot Study","Jones E, Stentz R, Telatin A, Savva GM, Booth C, Baker D, Rudder S, Knight SC, Noble A, Carding SR.","Genes (Basel). 2021 Oct 18;12(10):1636. doi: 10.3390/genes12101636.","Jones E","Genes (Basel)","2021","2021/10/23","PMC8535827","","10.3390/genes12101636"
"34603210","The Sick Adipose Tissue: New Insights Into Defective Signaling and Crosstalk With the Myocardium","Bermúdez V, Durán P, Rojas E, Díaz MP, Rivas J, Nava M, Chacín M, Cabrera de Bravo M, Carrasquero R, Ponce CC, Górriz JL, D Marco L.","Front Endocrinol (Lausanne). 2021 Sep 15;12:735070. doi: 10.3389/fendo.2021.735070. eCollection 2021.","Bermúdez V","Front Endocrinol (Lausanne)","2021","2021/10/04","PMC8479191","","10.3389/fendo.2021.735070"
"34416387","Microbiota modulate Doxorubicin induced cardiotoxicity","An L, Wuri J, Zheng Z, Li W, Yan T.","Eur J Pharm Sci. 2021 Nov 1;166:105977. doi: 10.1016/j.ejps.2021.105977. Epub 2021 Aug 17.","An L","Eur J Pharm Sci","2021","2021/08/20","","","10.1016/j.ejps.2021.105977"
"32005442","Berberine for prevention of dementia associated with diabetes and its comorbidities: A systematic review","Shinjyo N, Parkinson J, Bell J, Katsuno T, Bligh A.","J Integr Med. 2020 Mar;18(2):125-151. doi: 10.1016/j.joim.2020.01.004. Epub 2020 Jan 16.","Shinjyo N","J Integr Med","2020","2020/02/02","","","10.1016/j.joim.2020.01.004"
"32296838","Characterization of Gut Microbiota Composition in Hemodialysis Patients With Normal Weight Obesity","Lin TY, Wu PH, Lin YT, Hung SC.","J Clin Endocrinol Metab. 2020 Jun 1;105(6):dgaa166. doi: 10.1210/clinem/dgaa166.","Lin TY","J Clin Endocrinol Metab","2020","2020/04/17","","","10.1210/clinem/dgaa166"
"29946072","Pulmonary Arterial Hypertension Affects the Rat Gut Microbiome","Callejo M, Mondejar-Parreño G, Barreira B, Izquierdo-Garcia JL, Morales-Cano D, Esquivel-Ruiz S, Moreno L, Cogolludo Á, Duarte J, Perez-Vizcaino F.","Sci Rep. 2018 Jun 26;8(1):9681. doi: 10.1038/s41598-018-27682-w.","Callejo M","Sci Rep","2018","2018/06/28","PMC6018770","","10.1038/s41598-018-27682-w"
"30994937","Gut microbiome interventions in human health and diseases","Nie P, Li Z, Wang Y, Zhang Y, Zhao M, Luo J, Du S, Deng Z, Chen J, Wang Y, Chen S, Wang L.","Med Res Rev. 2019 Nov;39(6):2286-2313. doi: 10.1002/med.21584. Epub 2019 Apr 17.","Nie P","Med Res Rev","2019","2019/04/18","","","10.1002/med.21584"
"35279596","Targeting NLRP3 inflammasome modulates gut microbiota, attenuates corticospinal tract injury and ameliorates neurobehavioral deficits after intracerebral hemorrhage in mice","Xiao L, Zheng H, Li J, Zeng M, He D, Liang J, Sun K, Luo Y, Li F, Ping B, Yuan W, Zhou H, Wang Q, Sun H.","Biomed Pharmacother. 2022 May;149:112797. doi: 10.1016/j.biopha.2022.112797. Epub 2022 Mar 10.","Xiao L","Biomed Pharmacother","2022","2022/03/13","","","10.1016/j.biopha.2022.112797"
"35246797","Obstructive Sleep Apnea and Hypertension: Updates to a Critical Relationship","Brown J, Yazdi F, Jodari-Karimi M, Owen JG, Reisin E.","Curr Hypertens Rep. 2022 Mar 5:1-12. doi: 10.1007/s11906-022-01181-w. Online ahead of print.","Brown J","Curr Hypertens Rep","2022","2022/03/05","PMC8897114","","10.1007/s11906-022-01181-w"
"27129691","Gut microbiome and kidney disease: a bidirectional relationship","Al Khodor S, Shatat IF.","Pediatr Nephrol. 2017 Jun;32(6):921-931. doi: 10.1007/s00467-016-3392-7. Epub 2016 Apr 29.","Al Khodor S","Pediatr Nephrol","2017","2016/05/01","PMC5399049","","10.1007/s00467-016-3392-7"
"32701381","Gut microbes in pediatric ALL survivorship","Sly LM.","Pediatr Hematol Oncol. 2020 Sep;37(6):451-454. doi: 10.1080/08880018.2020.1793850. Epub 2020 Jul 23.","Sly LM","Pediatr Hematol Oncol","2020","2020/07/24","","","10.1080/08880018.2020.1793850"
"35378966","Disorders of gut microbiota in children with Tetralogy of Fallot","Liu X, Lu S, Shao Y, Zhang D, Tu J, Chen J.","Transl Pediatr. 2022 Mar;11(3):385-395. doi: 10.21037/tp-22-33.","Liu X","Transl Pediatr","2022","2022/04/05","PMC8976677","","10.21037/tp-22-33"
"25692344","The immunity-diet-microbiota axis in the development of metabolic syndrome","Brandsma E, Houben T, Fu J, Shiri-Sverdlov R, Hofker MH.","Curr Opin Lipidol. 2015 Apr;26(2):73-81. doi: 10.1097/MOL.0000000000000154.","Brandsma E","Curr Opin Lipidol","2015","2015/02/19","","","10.1097/MOL.0000000000000154"
"35090382","Fabry disease - a multisystemic disease with gastrointestinal manifestations","Lenders M, Brand E.","Gut Microbes. 2022 Jan-Dec;14(1):2027852. doi: 10.1080/19490976.2022.2027852.","Lenders M","Gut Microbes","2022","2022/01/29","PMC8803088","","10.1080/19490976.2022.2027852"
"35122992","Can Resveratrol Supplementation Reduce Uremic Toxin Plasma Levels From the Gut Microbiota in Nondialyzed Patients With Chronic Kidney Disease?","Alvarenga L, Cardozo LFMF, Leal VO, Kemp JA, Saldanha JF, Ribeiro-Alves M, Meireles T, Nakao LS, Mafra D.","J Ren Nutr. 2022 Feb 3:S1051-2276(22)00010-3. doi: 10.1053/j.jrn.2022.01.010. Online ahead of print.","Alvarenga L","J Ren Nutr","2022","2022/02/05","","","10.1053/j.jrn.2022.01.010"
"33127878","Age-related cerebral small vessel disease and inflammaging","Li T, Huang Y, Cai W, Chen X, Men X, Lu T, Wu A, Lu Z.","Cell Death Dis. 2020 Oct 30;11(10):932. doi: 10.1038/s41419-020-03137-x.","Li T","Cell Death Dis","2020","2020/10/31","PMC7603301","","10.1038/s41419-020-03137-x"
"33379162","Is Gut Microbiota Dysbiosis a Predictor of Increased Susceptibility to Poor Outcome of COVID-19 Patients? An Update","Ferreira C, Viana SD, Reis F.","Microorganisms. 2020 Dec 28;9(1):53. doi: 10.3390/microorganisms9010053.","Ferreira C","Microorganisms","2020","2020/12/31","PMC7824665","","10.3390/microorganisms9010053"
"31936113","Impact of Nutrition on Pulmonary Arterial Hypertension","Callejo M, Barberá JA, Duarte J, Perez-Vizcaino F.","Nutrients. 2020 Jan 7;12(1):169. doi: 10.3390/nu12010169.","Callejo M","Nutrients","2020","2020/01/16","PMC7019983","","10.3390/nu12010169"
"35143331","Alcohol-Associated Tissue Injury: Current Views on Pathophysiological Mechanisms","Simon L, Souza-Smith FM, Molina PE.","Annu Rev Physiol. 2022 Feb 10;84:87-112. doi: 10.1146/annurev-physiol-060821-014008.","Simon L","Annu Rev Physiol","2022","2022/02/10","","","10.1146/annurev-physiol-060821-014008"
"28674682","The Microbiome and Blood Pressure: Can Microbes Regulate Our Blood Pressure?","Al Khodor S, Reichert B, Shatat IF.","Front Pediatr. 2017 Jun 19;5:138. doi: 10.3389/fped.2017.00138. eCollection 2017.","Al Khodor S","Front Pediatr","2017","2017/07/05","PMC5474689","","10.3389/fped.2017.00138"
"23325079","The intestinal microbiota, a leaky gut, and abnormal immunity in kidney disease","Anders HJ, Andersen K, Stecher B.","Kidney Int. 2013 Jun;83(6):1010-6. doi: 10.1038/ki.2012.440. Epub 2013 Jan 16.","Anders HJ","Kidney Int","2013","2013/01/18","","","10.1038/ki.2012.440"
"31889008","Short-Chain Fatty Acids Improve Poststroke Recovery via Immunological Mechanisms","Sadler R, Cramer JV, Heindl S, Kostidis S, Betz D, Zuurbier KR, Northoff BH, Heijink M, Goldberg MP, Plautz EJ, Roth S, Malik R, Dichgans M, Holdt LM, Benakis C, Giera M, Stowe AM, Liesz A.","J Neurosci. 2020 Jan 29;40(5):1162-1173. doi: 10.1523/JNEUROSCI.1359-19.2019. Epub 2019 Dec 30.","Sadler R","J Neurosci","2020","2020/01/01","PMC6989004","","10.1523/JNEUROSCI.1359-19.2019"
"25840582","Oral Infections, Metabolic Inflammation, Genetics, and Cardiometabolic Diseases","Janket SJ, Javaheri H, Ackerson LK, Ayilavarapu S, Meurman JH.","J Dent Res. 2015 Sep;94(9 Suppl):119S-27S. doi: 10.1177/0022034515580795. Epub 2015 Apr 3.","Janket SJ","J Dent Res","2015","2015/04/05","","","10.1177/0022034515580795"
"35087883","Immune Mechanisms of Plaque Instability","Gerhardt T, Haghikia A, Stapmanns P, Leistner DM.","Front Cardiovasc Med. 2022 Jan 11;8:797046. doi: 10.3389/fcvm.2021.797046. eCollection 2021.","Gerhardt T","Front Cardiovasc Med","2022","2022/01/28","PMC8787133","","10.3389/fcvm.2021.797046"
"33563307","Diesel exhaust particles alter the profile and function of the gut microbiota upon subchronic oral administration in mice","van den Brule S, Rappe M, Ambroise J, Bouzin C, Dessy C, Paquot A, Muccioli GG, Lison D.","Part Fibre Toxicol. 2021 Feb 9;18(1):7. doi: 10.1186/s12989-021-00400-7.","van den Brule S","Part Fibre Toxicol","2021","2021/02/10","PMC7871568","","10.1186/s12989-021-00400-7"
"28597403","Resistant Hypertension: Mechanisms and Treatment","Hwang AY, Dietrich E, Pepine CJ, Smith SM.","Curr Hypertens Rep. 2017 Jul;19(7):56. doi: 10.1007/s11906-017-0754-x.","Hwang AY","Curr Hypertens Rep","2017","2017/06/10","","","10.1007/s11906-017-0754-x"
"33823861","The dysbiosis signature of Fusobacterium nucleatum in colorectal cancer-cause or consequences? A systematic review","Ranjbar M, Salehi R, Haghjooy Javanmard S, Rafiee L, Faraji H, Jafarpor S, Ferns GA, Ghayour-Mobarhan M, Manian M, Nedaeinia R.","Cancer Cell Int. 2021 Apr 6;21(1):194. doi: 10.1186/s12935-021-01886-z.","Ranjbar M","Cancer Cell Int","2021","2021/04/07","PMC8025348","","10.1186/s12935-021-01886-z"
"31234533","Effects of Fish n-3 PUFAs on Intestinal Microbiota and Immune System","Parolini C.","Mar Drugs. 2019 Jun 22;17(6):374. doi: 10.3390/md17060374.","Parolini C","Mar Drugs","2019","2019/06/26","PMC6627897","","10.3390/md17060374"
"32244932","Modelling the Impact of Chronic Cigarette Smoke Exposure in Obese Mice: Metabolic, Pulmonary, Intestinal, and Cardiac Issues","Dubois-Deruy E, Rémy G, Alard J, Kervoaze G, Chwastyniak M, Baron M, Beury D, Siegwald L, Caboche S, Hot D, Gosset P, Grangette C, Pinet F, Wolowczuk I, Pichavant M.","Nutrients. 2020 Mar 20;12(3):827. doi: 10.3390/nu12030827.","Dubois-Deruy E","Nutrients","2020","2020/04/05","PMC7175208","","10.3390/nu12030827"
"33668518","Exploring the Potential Role of the Gut Microbiome in Chemotherapy-Induced Neurocognitive Disorders and Cardiovascular Toxicity","Ciernikova S, Mego M, Chovanec M.","Cancers (Basel). 2021 Feb 13;13(4):782. doi: 10.3390/cancers13040782.","Ciernikova S","Cancers (Basel)","2021","2021/03/06","PMC7918783","","10.3390/cancers13040782"
"27757226","The microbiota and chronic kidney diseases: a double-edged sword","Felizardo RJ, Castoldi A, Andrade-Oliveira V, Câmara NO.","Clin Transl Immunology. 2016 Jun 10;5(6):e86. doi: 10.1038/cti.2016.36. eCollection 2016 Jun.","Felizardo RJ","Clin Transl Immunology","2016","2016/10/21","PMC5067952","","10.1038/cti.2016.36"
"32317013","Brain-heart interaction after acute ischemic stroke","Battaglini D, Robba C, Lopes da Silva A, Dos Santos Samary C, Leme Silva P, Dal Pizzol F, Pelosi P, Rocco PRM.","Crit Care. 2020 Apr 21;24(1):163. doi: 10.1186/s13054-020-02885-8.","Battaglini D","Crit Care","2020","2020/04/23","PMC7175494","","10.1186/s13054-020-02885-8"
"35066820","Potentially Probiotic Limosilactobacillus fermentum Fruit-Derived Strains Alleviate Cardiometabolic Disorders and Gut Microbiota Impairment in Male Rats Fed a High-Fat Diet","de Araújo Henriques Ferreira G, Magnani M, Cabral L, Brandão LR, Noronha MF, de Campos Cruz J, de Souza EL, de Brito Alves JL.","Probiotics Antimicrob Proteins. 2022 Apr;14(2):349-359. doi: 10.1007/s12602-021-09889-y. Epub 2022 Jan 23.","de Araújo Henriques Ferreira G","Probiotics Antimicrob Proteins","2022","2022/01/23","","","10.1007/s12602-021-09889-y"
"32260440","Milk Polar Lipids: Underappreciated Lipids with Emerging Health Benefits","Anto L, Warykas SW, Torres-Gonzalez M, Blesso CN.","Nutrients. 2020 Apr 4;12(4):1001. doi: 10.3390/nu12041001.","Anto L","Nutrients","2020","2020/04/09","PMC7230917","","10.3390/nu12041001"
"34438804","Owning a Pet Is Associated with Changes in the Composition of Gut Microbiota and Could Influence the Risk of Metabolic Disorders in Humans","Arenas-Montes J, Perez-Martinez P, Vals-Delgado C, Romero-Cabrera JL, Cardelo MP, Leon-Acuña A, Quintana-Navarro GM, Alcala-Diaz JF, Lopez-Miranda J, Camargo A, Perez-Jimenez F.","Animals (Basel). 2021 Aug 9;11(8):2347. doi: 10.3390/ani11082347.","Arenas-Montes J","Animals (Basel)","2021","2021/08/27","PMC8388619","","10.3390/ani11082347"
"30474051","Dietary Polysaccharides in the Amelioration of Gut Microbiome Dysbiosis and Metabolic Diseases","Ahmadi S, Mainali R, Nagpal R, Sheikh-Zeinoddin M, Soleimanian-Zad S, Wang S, Deep G, Kumar Mishra S, Yadav H.","Obes Control Ther. 2017;4(3):10.15226/2374-8354/4/2/00140. doi: 10.15226/2374-8354/4/2/00140. Epub 2017 Dec 18.","Ahmadi S","Obes Control Ther","2017","2018/11/27","PMC6249025","NIHMS991536","10.15226/2374-8354/4/2/00140"
